670856,2021-06-13,Köhnə tikili,1 / 1,50,2,Kupça,127000,Vasitəçi / Rieltor,"Torqovıda , Vətən Kinoteatrının yanında , Bulvara 10 dəqiqəlik məsafədə , sahəsi 50 kv.m. olan 2 otaqlı mənzil satılır . Mənzil mübüllərlə birlikdə satılır . Sərmaye qoymaq üçün gözəl təklifdir . Mənzilin hündürlüyü 3.80 metr . Mənzil kirayə vermək üçün əlverişli lokasiyada yerləşir",17,Bakı,Səbail rayonu,metro. Sahil,""
670853,2021-06-13,Yeni tikili,16 / 5,65,2,Kupça,64000,Vasitəçi / Rieltor,"Xirdalanda Heydər Əliyev Prospektinin kənarında yerləşən qazli kupcali  16 mertebeli binanin 5 ci  mertebesi umumi sahesi 65 kv olan qanuni 2 otaqlı yeni  temirdən çıxmış  menzil satilir. Bina yaşayışlı binadır,  qaz su iwiq daimdir. binanin suretli 2 lifti var 24 saat muhafize olunur.binanın Yaxinliginda mekteb, baxca, marketler ve diger ictimai iawe abyektleri movcuddur. bina tam yawaywli binadir senedi kupcadir. Bu və digər elanlarla əlaqədar ətraflı məlumat almaq üçün əlaqə nömrəsinə zəng vura bilərsiniz.",18,Xırdalan ş.,"","",""
670852,2021-06-13,Yeni tikili,5 / 1,30,1,Kupça,52000,Vasitəçi / Rieltor,Orta temirli,23,Bakı,Binəqədi rayonu,9-cu mikrorayon,metro. Nəsimi
596228,2021-06-13,Yeni tikili,14 / 2,125,3,Kupça,168000,Vasitəçi / Rieltor,Qara Qarayev İnci restoranının yanı 14 mərtəbəli binanın 2-cı mərtəbəsi 3 otaq 4 otaq duzelib 125 kv orta təmirli qaz su kombi var.Ətrafında böyük marketlər var.Mənzilin qiyməti  168000 AZN.Xahiş olunur ciddi şəxslər narahat etsin.,13,Bakı,Nizami rayonu,8-ci kilometr,metro. Qara Qarayev
670849,2021-06-13,Köhnə tikili,9 / 7,70,2,Kupça,77000,Vasitəçi / Rieltor,"Bakı şəhəri, Xətai rayonu, Köhnə Günəşli qəsəbəsi, Rahat marketlə üzbəüz leninqrad layihəsi, 9 mərtbəli binanın 7 ci mərtbəsində tam təmirli, dəniz panaramalı 2 otaqlı mənzil satılır. Mənzil, Köhnə Günəşlinin tam mərkəzində yerləşir.Mənzilin tam yaxınlığında Rahat Market və Hiper Bizim Market yerləşir.Mənzil 2 balkondan ibarətdir. Yer palıd üzlüyə malik olan parketlə döşənib və yüksək keyfiyyətli oboy örütklər ilə üzlənib. Mərkəzi istilik sistemi ilə təchiz olunmuşdur.Mənzil orta hissədə yerləşir uqlovoy deyil.Bina hətta yaxın zamanda yeni liftlə də təmin olunacaq.Mənzilin tam qarşısında bağça, çox yaxın məsafədə yerləşən müasir standarlara cavab verən məktəb və yeni istifadəyə verilmiş uşağlar üçün nəzərdə tutulmuş atraksionlar, böyüklər üçün isə idman alətləri olan, və yaşıllıqla əhatə olunmuş park salınmışdır. Mənzilin tam yaxınlığında 40,46,104 nömrəli avtobuslar intensiv fəaliyyət göstərir.Bununla yanaşı olaraq, Həzi Aslanov və Əhmədli metrosuna avtomobil ilə 5-7 dəqiqəlik, avtobusla 12-15 dəqiqəlik məsafədə yerləşir.Mənzil ipotekaya yararlıdır. REAL ALICIYA ENDİRİM OLUNACAQ.",23,Bakı,Xətai rayonu,"",""
670847,2021-06-13,Köhnə tikili,9 / 7,60,2,Kupça,109000,Vasitəçi / Rieltor,"ƏŞYALARLA !!! KUPCALİ !!! İPOTEKAYA YARARLİ !!!!  AZADLIQ PROSPEKTİ METROSUNUN çıxışında yerləşən Leninqrad layihəli binanın 7ci mərtəbəsində rodnoy 2 otaqlı təmirli mənzil satılır. Mənzil Orta blokda yerləşir, yelçəkəndir. Həyətində 83 nömrəli Məktəb-lisey , uşaq bağçası, aptek, Araz market yerləşir.  REAL aliciya endirim olacaq !!    Alici terefinden sirkete 1% xidmet haqqi verilir.",15,Bakı,Binəqədi rayonu,8-ci mikrorayon,""
670846,2021-06-13,Yeni tikili,9 / 9,85,4,Kupça,140000,Əmlak sahibi,"TƏCİLİ SATILIR  8 Noyabr metro stansiyasının və Həsən Əliyev küçəsinin yaxınlığında 9 mərtəbəli binanın 9-cu mərtəbəsində 85 kv m. sahəli orta təmirli 4 otaqlı mənzil satılır. Ünvan Azər Əliyev küç. 9a, orta blok.  Yelçekən mənzildir. Otaqlar ayrı-ayrı, 3 balkon var, otaqlara qoşulub. Sənəd çıxarışdır. Qeydiyyatda 1 nəfər var. Mənzildən dənizə və Hərbi Hospitala mənzərə var. İşiq,su və qaz daimidir. Mərkəzi istilik sistemi. Kabel TV var.   Blok yeni təmirlidir, müasir və səssiz lift ilə təmin edilib. Bloka giriş domofonladır. Binanın həyətində parking yeri və uşaq meydançası var. Bütün infrastrukturlar yaxınlıqda yerləşir.  Qiymət 140.000 manat  Əlaqə üçün: 0506329903   Sahibinnən satılır.",23,Bakı,Nəsimi rayonu,metro. 8 Noyabr,""
670845,2021-06-13,Yeni tikili,16 / 10,96,2,Kupçasız,133000,Vasitəçi / Rieltor,Super təmir ev Əcəmi metrosuna 200 metir məsafədə 16/10 cı mətəbəsində radnoy 2 otaqlı mənzil cox əla təmir təmrdən sonra yaşaış olmayıb binada tam yaşaış var yer parket pərdələr kombi var isdənlən vaxt baxmaq olar başqa hər bir qiymətə evlər var qiymətdə razlaşmaq da olar,11,Bakı,Nəsimi rayonu,5-ci mikrorayon,metro. Memar Əcəmi
670843,2021-06-13,Köhnə tikili,5 / 1,45,2,Kupça,65000,Vasitəçi / Rieltor,Nizami rayonu Icra Hakimiyyəti arxasi 5 mertebeli binanin 1 ci mertebesi (belyy etaj) satilir,24,Bakı,Nizami rayonu,metro. Neftçilər,""
670839,2021-06-13,Yeni tikili,13 / 3,52,2,Kupçasız,50000,Vasitəçi / Rieltor,"Xırdalan şəhəri Texnikoma yaxın Bakı-Sumqayıt yolunun  kənarında  yerleshen 13 mərtəbəli binanın 3-cü mərtəbəsində ümumi sahəsi 52 kv olan 2 otağa düzəlmə  temirli mənzil əşyaları ilə satılır. Qaz su, ishiq daimidir. Sənədi Şirkətə məxsus  müqaviləsidir. Yaşayış kompleksi 24 saat mühafizə olunur. Binanin yaxinliginda 3 saylı mekteb, baxca, ve  Bazarstor və Rahat  market və  diger ictimai iawe abyektleri movcuddur. Bu və digər elanlarla əlaqədar ətraflı məlumat almaq üçün əlaqə nömrəsinə zəng vura bilərsiniz.",22,Xırdalan ş.,"","",""
623427,2021-06-13,Yeni tikili,19 / 7,67,2,Kupça,76000,Əmlak sahibi,Razin Akkoord binalarinda 20/7 ci yuksek keyfiyyetli materiallarla ela keyfiyyetli temir olunmus menzili satiram.Menzil gun tutan terefe baxir.Panoram baximinda cox gozel ve rahatladici goz oxsayan gorunus acilir.Menzilde xolda..metbexde..ve s/uzel qovsaginda dosemefr isti pol sistemi qurasdirilib.Kombi sistemiyle birlikde kollektor sistemide cekilmisdir.senedi kupcadir daimi posport qeyydiyyati bosdur.Menzil sexsi istifade ucun temir olunmusdur..Bas lanigic qiymet i 85 000 azn.dir.istenilen vaxt baxmaq olar.,44,Bakı,Sabunçu rayonu,Bakıxanov qəs.,metro. Koroğlu
670830,2021-06-13,Köhnə tikili,9 / 8,60,3,Kupça,107000,Vasitəçi / Rieltor,"Yeni Yasamal ərazisində, Osmanlı Hamamın yaxınlığında 9 mərtəbəli binanın 8-ci  mərtəbəsində 3 otaqlı mənzil satılır. Çıxarış(kupça) mövcuddur. Ətrafda Bravo və digər  ticarət obyektləri, uşaq bağçası, məktəb, xəstəxana yerləşir. Mənzilin 1 balkonu var, yelçəkəndir, Mənzildə mərkəzi istilik sistemidir.",16,Bakı,Yasamal rayonu,Yeni Yasamal qəs.,""
670828,2021-06-13,Köhnə tikili,5 / 3,64,3,Kupça,115000,Əmlak sahibi,Metroya 3 deq yol cox tecili satilir kupca var ev ozumundur,17,Bakı,Yasamal rayonu,Yasamal qəs.,metro. İnşaatçılar
670826,2021-06-13,Köhnə tikili,5 / 3,65,3,Kupça,70000,Vasitəçi / Rieltor,"Bileceride ağ saray şadlıq evinin yanında.3 otaq xruşov layihe , mertebe 5/3 ,orta blok, 2 bağlı balkonu var merkezi istilik sistemi var, skvaznoy menzildir.Sened kupça.",22,Bakı,Binəqədi rayonu,Biləcəri qəs.,metro. Avtovağzal
670821,2021-06-13,Yeni tikili,12 / 10,41,1,Kupça,34000,Əmlak sahibi,"Menzil yulsek keyfiyyetle temir olinub. 1-in 2-ye duzeldilib. Yataq desti ile metbext mebeli qalacaq.  Ilkin odenish 34 000 azn, 53 ay 425 azm odemekle goture bilersiniz.  Nagd ise 52 000 azn",30,Xırdalan ş.,"","",""
670819,2021-06-13,Yeni tikili,17 / 3,101,3,Kupça,134900,Vasitəçi / Rieltor,Cooox tecili   TEMİRLİ    TECILI DUSME TEKLIF    Pilot lahiyəli novostroykadir...  17-- mərtəbəli binanın..  3 -otaqli geniş mənzildir...  Sənəd kupca Çixariş.  Hazir alqi satqı sənədidir...  Mənzil təmirlidir...  Otaqlarda kombinin xəttləri çəkilib...  mənzildə yaşayiş olmayib...  Komunal. Qaz su işig saygaclari var...  2 balkonu var.. Binanin lift var...  24 nomrəli avtobuslar Binanin qabagindan işləyir .,29,Bakı,Nərimanov rayonu,metro. Nəriman Nərimanov,""
670818,2021-06-13,Yeni tikili,16 / 14,87,3,Kupça,19000,Vasitəçi / Rieltor,"HAZIR IPOTEKA!!!! 25 İlədək!! Xirdalan seheri Heyder Eliyev prospektinin ustunde insa edilmis 16 mertebeli kupcali,isiqi,suyu,qazi fasilesiz verilen  binada ipoteka teklifi.Muxtelif kvadratlar var.24 saat muhafize,genis ve seliqeli heyet, sürətli liftlər, yeraltı qaraj Məktəb, bağça, supermarket piyada məsafəsindədir Resmi maas mutleqdir.Etrafli melumat ucun qeyd etdiyim nomreyle elaqe saxlaya bilersiz.",86,Xırdalan ş.,"","",""
670816,2021-06-13,Köhnə tikili,9 / 8,110,4,Kupça,118000,Vasitəçi / Rieltor,Tecili Qazli Kupcali ipotekaya yararli.. Yeni Yasamal M.Xiyabani küçəsində Bravonun yaninda 9 mertebeli binanin 8-ci mertebesinde orta blokda radnoy 4 otaqli ela temirli menzil satılır.qaz isiq su daimidi..merkezi isdilik movcutdur..Menzilin yaxininda bacxa mekteb xestexana super marketler bir sozle lazimi olan butun infrastruktur movcutdur real aliciya endirim olunacaq.elimizde bu tipli basqa menziller de var..ciddi sexsler elaqe saxlasinlar...ofis Haqqi 1%,25,Bakı,Yasamal rayonu,Yeni Yasamal qəs.,metro. İnşaatçılar
670814,2021-06-13,Yeni tikili,17 / 16,100,3,Kupça,143000,Vasitəçi / Rieltor,"Təcili. Nəsimi rayonu, Memar Əcəmi metrosunun yaxınlığında inşa edilən Yeni tikili binada 2 otaqdan 3 otağa düzəlmə 100 kv/m təmirli və ÇIXARIŞLI mənzil satılır. Mənzil 17 mərtəbəli binanın 16-cı mərtəbəsində yerləşir, əşyalı satılır, şəkildəki əşyalar qiymətə daxildir. Yerləşdiyi yer əlverişlidir məktəbi, uşaq bağçası, brend mağazaları, ofisləri, brend kafe və restoranları, bankları, avtobus dayanacağı, metroları və s. şəhərin istənilən yerinə rahat və komfortlu hərəkət.",15,Bakı,Nəsimi rayonu,2-ci mikrorayon,metro. Memar Əcəmi
670813,2021-06-13,Köhnə tikili,4 / 2,50,3,Kupça,57000,Əmlak sahibi,"4 faizlik güzəştli ipoteka da ola 4 mərtəbəli binanin 2-ci mərtəbəsi orta blok..tam təmirli..2-dən 3-ə düzəlmə..1 nöm məktəbə, Kapital Banka, H.Əliyev parkına, Poliknikaya, 119 nöm marşurutunu yoluna yaxın yerdə yerləşir..2014-cü ildə 30 illik götürülüb...aylıq ödənişi 217 man.İlkin ödəniş 18000 manat....Ancaq güzəştli  (4faizli) ipotekaya şamil olan və həmin şəxsin banklarda ödəniş üzrə gecikməsi olmayan kateqoriyalar narahat etsin....",19,Xırdalan ş.,"","",""
670812,2021-06-13,Yeni tikili,14 / 3,140,3,Kupçasız,200000,Vasitəçi / Rieltor,28 May Nizami ve Sahil metrolarinin yani Qish Parkinin SIRKIN yani 14 mertebenin 3 cu mertebesi 3 otaqli sahesi 140 kv metr olan padmayakt menzil 200000 AZn satilir sheherin merkezi Teze bazar SIRK in yani ve s Indiki bazar qiymetinden ashagi satilir bu binada bu qiymete menzil yoxdur,16,Bakı,Nəsimi rayonu,metro. 28 May,""
656502,2021-06-13,Yeni tikili,18 / 4,90,3,Kupça,130000,Vasitəçi / Rieltor,COOX TECILI !! Nesimi rayonu 28 may metrosunun cixisinin yaninda 2+1 layiheli podmayakl menzil satilir !! qaz su isiq daimdir !! KUPCA YAXIN GUNLERDE VERILECEK !!PILOT LAYIHELI BINADIR !! real alicilar elaqe saxlaya biler !! Binada 2 3 aydan coxdur yasayis var !! ofis haqqi 1 faiz !!,15,Bakı,Nəsimi rayonu,metro. 28 May,""
672568,2021-06-14,Yeni tikili,20 / 14,240,4,Kupça,330000,Vasitəçi / Rieltor,BÜTÜN PENCERELERİ DENİZE BAXAN !!!  4 otaqli podmayak menzil !!!  28 May metrosunun yaxinliginda !  Senedler qaydasindadir !  Alici terefinden şirkete 1% odenilir,14,Bakı,Nəsimi rayonu,"",""
672567,2021-06-14,Yeni tikili,13 / 9,100,2,Kupçasız,108000,Vasitəçi / Rieltor,TECILI !!!!!! Mənzil təmirsizdir.Azadliq metrosunun yaxınlığında yerləşir.Binanin geniş həyəti maşın saxlamağa ərazisi genişdir.Ətraflı məlumat almaq üçün əlaqə saxlaya bilərsiz bina butun infrastktura yaxiunliqda yerlsir!!! yaxinliqda mekteb bagca Supermarketler ve s yerlesir !!! binaya sayqaclar ekilib fasad tam hazirdir ! LIFT qurasdirlib qaz su isiq damidir !!! Sirketin xidmet haqqi 1% teskil edir !!    KUPCA VERILECEK !!!!,13,Bakı,Binəqədi rayonu,7-ci mikrorayon,""
672566,2021-06-14,Yeni tikili,14 / 9,110,3,Kupça,163000,Vasitəçi / Rieltor,TECILI OLARAQ SATILIR !!    METRO XETAI ile 5 deqiqe piyade mesafede yeni tikilmis 14 mertebeli binain 9 cu mertebesinde yerlesen padmayak ev tecili olaraq satilir !!    ALICI TEREFDEN 1 % SIRKET HAQQI ODENILMELDIR!!    elave melumat ucun qeyd olunan nomre ile elaqe saxliya bilersiniz !!k,10,Bakı,Xətai rayonu,metro.  Xətai,""
672564,2021-06-14,Köhnə tikili,9 / 9,85,3,Kupça,103000,Vasitəçi / Rieltor,Tecili  Satilir !!! Nesimi  Rayonu   Nesimi  M  Yaninda  30 Nomreli  Mektebin Yaninda  9 mertebeli  Lelinqirat  Lahiyeli  Binanin 9 cu  mertebesinde  3 otaqli  Menzil  Satilir  !!! Binanin  Qazi  suyu Isigi  Damidi  . Binanin  yaninda  Mekteb  Usaq  Baxcasi  Marketler  Park  ve bir  Cox  insa  obyektleri  yerlesir Xais olunur Real  Alicilar  Elaqe Saxlasinlar  Alici  terfden  Sirket  Xidmet  Haqqi 1% Odenilecek  .,12,Bakı,Nəsimi rayonu,metro. Nəsimi,""
672561,2021-06-14,Yeni tikili,12 / 5,300,5,Kupça,824000,Vasitəçi / Rieltor,ƏLA TƏKLİF GÖLƏ PANORAMA !!!    Nərimanov rayonunda ölkənin ən elit komplekslərindən olab Roseville yaşayış kompleksində radnoy 5 otaqlı kupçalı podmayak mənzil satılır.Mənzilin gözəl planirovkası var.Mənzilin həyətə və gölə panoraması var.Şəhərimizin ən elit kompkleksi olan Rosevillede 24 saat mühafizə 3 mərtəbəli yeraltıqaraj 3 sürətli lift var.Binanın yaxınlarınızla səmərəli vaxtlarınızı keçirmək üçün gözəl parkı böyük basennisi var.Binanın altında supermarket əyləncə mərkəzi bir çox ticarət obyektləri var...    REAL ALICILAR NARAHAT ETSİN !!! OFİSİN XİDMƏT HAQQI 1 % TƏŞKİL EDİR...,14,Bakı,Nərimanov rayonu,"",""
672560,2021-06-14,Yeni tikili,20 / 8,190,4,Kupça,275000,Vasitəçi / Rieltor,"TECILI OLARAQ SATILIR !!!    Premium klass deniz menzereli 4 otaqli menzil! Vitraj pencereler, 2 sanitar qovshaq . Bina sentyabr ayinda tehvil verilecek. Tecili oldugu ucun bu qiymete satilir! Qonshu binalarda bu qiymete ev yoxdur    ALICI TEREFDEN 1 % SIRKET HAQQI ODENILMELIDIR !  elave melumat ucun qeyd olunan nomre ile elaqe saxliya bilersiniz !",10,Bakı,Xətai rayonu,metro.  Xətai,""
631315,2021-06-14,Yeni tikili,7 / 6,41,1,Kupça,45000,Vasitəçi / Rieltor,Xirdalanda kristal abseron yaşayş komplksinde kohne bazarin yaninda yeni tikili 7 mertebeli binanin 6 ci mertebesi orginal 1 otaqli menzil binada qaz su işiq daimdir 24 saat muhafize binanin işlek lifti var bina tam yaşayşli binadir sened kupca satişda başqa menzillermzde var,4,Xırdalan ş.,"","",""
672558,2021-06-14,Köhnə tikili,5 / 3,100,3,Kupça,157000,Vasitəçi / Rieltor,"Tecili !!! Yasamal rayonu , Statistika idaresinin yaxinligi  Izmir kucesi  Izmir parki ile uzbe - uz 5 mertebeli Stalinka layiheli binanin 3-cu mertebesinde (orta blok) 3 otaqli umumi  sahesi 100 kvm olan ela temirli menzil satilir . su , isiq, qaz daimidir . sirketin xidmet haqqi 1 % .",14,Bakı,Yasamal rayonu,metro. Elmlər Akademiyası,""
648877,2021-06-14,Yeni tikili,9 / 6,52,2,Kupça,53000,Vasitəçi / Rieltor,Xirdalanda kristal abseron yaşayiş komplksinde kohne bazarin yani 9 mertebeli binanin 5 ci mertebesi 2 otaga şirket terefinden duzelme menzil binada qaz su işiq daimdir 24 saat muhafize binanin işlek lifti var komplksin heyetinde butun iaşe abyektleri barki bagcasi var menzilde istilik sistemi kombidir sened kupca satişda başqa menzillermzde var,3,Xırdalan ş.,"","",""
661629,2021-06-14,Yeni tikili,15 / 11,53.4,2,Kupça,58500,Vasitəçi / Rieltor,Xirdalanda kristal abseron yaşYiş komplksinde icra hakimiyyetinin yani suret qatarina yaxin 15 mertrbeli binanin 11 ci mertrbesi 2 otaga duzelme menzil binada qaz su işiq daimdir 24 saat muhafize binanin 2 lifti var menzil şekilde gorunen eşyalarla satilir prospektde baxir sened kupca,2,Xırdalan ş.,"","",""
657442,2021-06-14,Yeni tikili,10 / 9,56,2,Kupça,57000,Vasitəçi / Rieltor,Xirdalanda kristal abseronda kohne bazarin yani orginal 2 otaqli menzil binada qaz su işiq daimdir 24 saat muhafize binanin işlek lifti var sened kupca,3,Xırdalan ş.,"","",""
670395,2021-06-14,Yeni tikili,16 / 9,59,2,Kupça,59000,Vasitəçi / Rieltor,Xirdalanda merkezde heyder parkinin yaninda dayanacaga yaxin mesafede yeni tikili 16 mertebeli binanin 9 ci mertebesi 2 otaqli  temirden yeni cxmiw super temirli menzil menzilin temirnde bahali materiallardan istifade olunub  temrden sonra menzilde yawayw olunmyib bina tam yawaywli binadir qaz su iwiq daimdir binanin 2 suretli lifti var sened kupca satwda bawqa menzillermzde var,4,Xırdalan ş.,"","",""
620417,2021-06-14,Yeni tikili,16 / 12,57,2,Kupça,51000,Vasitəçi / Rieltor,TECILİ SATILIR Xirdalanda heyder eliyev prospektinin kenarinda 16 mertrbeli binanin 12 ci mertebesi  2 otaqli temirden yeni cixmiw  super temirli  menzil  menizilin temirinde bahali materiallardan istifade olunub  binada qaz su iwiq daimdir 24 saat muhafize binanin  suretli 2 lifti bina tam yawawli binadir dayanacaga yaxindir sened kupca,1,Xırdalan ş.,"","",""
671055,2021-06-14,Yeni tikili,17 / 8,107,3,Kupçasız,107000,Vasitəçi / Rieltor,Xirdalanin tam merkezinde heyder parkinin yani yeni tikili 17 mertebeli binanin 8 ci mertebesi 3 otaqli temirden yeni cixmiş super temirli menzil binada qaz su işiq daimdir 24 saat muhafize binanin 2 lifti var tam yaşayişli binadir menzil bir başa heyder parkina baxir ela ponaramasi var şexsi istifade ucun temir olunub sened mtkaya mexsus muqaviledir yaxin mudetde bina kupcayla temin olunacaq,3,Xırdalan ş.,"","",""
642581,2021-06-14,Yeni tikili,15 / 14,62,2,Kupça,63000,Vasitəçi / Rieltor,Xirdalanda merkezde heyder parkinin yaninda dayanacaga yaxin mesafede yeni tikili 16 mertebeli binanin 14 ci mertebesi 2 otaqli  temirden yeni cxmiw super temirli menzil menzilin temirnde bahali materiallardan istifade olunub  temrden sonra menzilde yawayw olunmyib bina tam yawaywli binadir qaz su iwiq daimdir binanin 2 suretli lifti var sened kupca satwda bawqa menzillermzde var,1,Xırdalan ş.,"","",""
672554,2021-06-14,Yeni tikili,17 / 6,155,3,Kupça,270000,Vasitəçi / Rieltor,Tecili  Satilir !!! Bineqedi  Rayonu  8 ci  mkr  C.Xendan  kucesi   17 mertebeli  binanin  6 ci  mertebesinde  Sahesi  155 kvm  olan  Temirli  Menzil  Satilir !!! Binanin Qazi  suyu  Isigi  Damidi .  Binanin  Yaxinligda  Mekteb  Usaq  baxcasi   Park   Marketler  ve  Bir Cox  Insa  obyektleri  yerlesir  Xais  olunur Real  Alicilar  Elaqe  Saxlasinlar  Alici  terfden  Sirket  Xidmet  Haqqi  1% Odenilecek  .,12,Bakı,Binəqədi rayonu,8-ci mikrorayon,metro. Azadlıq prospekti
672553,2021-06-14,Köhnə tikili,9 / 4,62,3,Kupça,59900,Vasitəçi / Rieltor,Sumqayit seheri 9 mk 9/4. orta ev . kiev lahiyesi . 2 otaqdan 3 otaqa duzelme . Teze lifti var. kombisi var. Qiymet 59900 Azn,18,Sumqayıt,9-cu mikrorayon,"",""
672551,2021-06-14,Yeni tikili,17 / 5,198,4,Kupça,325000,Vasitəçi / Rieltor,"TECILI OLARAQ SATILIR !!    4 mikr. Dayresinde Meymar Ecemi metrosuna yaxin Yeni tikili Karvan MTK 16/5 mertebesi SUPER REMONTLU ev satilir , menzil sexsi istifade ucun remont olduguna gore bahali materiallardan istifade olunub    ALICI TEREFDEN 1 % SIRKET HAQQI ODENILMELIDIR !!    elave melumat ucun qeyd olunan nomre ile elaqe saxliya bilersiniz !!",10,Bakı,Nəsimi rayonu,4-cü mikrorayon,metro. Memar Əcəmi
671183,2021-06-14,Yeni tikili,17 / 14,52.5,2,Kupça,80000,Əmlak sahibi,1den 2ye peredelka yaxsi temirli menzil satilir.kupcasi var.ipotekaya yararlidir.baxisi cenuba terefdir.guntutan menzildir.,14,Bakı,Yasamal rayonu,Yeni Yasamal qəs.,metro. İnşaatçılar
672547,2021-06-14,Yeni tikili,7 / 5,161,4,Kupça,225000,Vasitəçi / Rieltor,TECILI OLARAQ DEYERINDEN ASAQI SATILIR !!    Hesen Eliyev kucesi(kecmis inqilab)yerlesen 7ertebeli apartman tipli binanin 4 cu mertebesinde 4 otaqli 161 kv m olan podmayak ev tecili satilir.Avrasiya klinikasi ile uz uze.Evin 2 penceresi Avrasiya klinikasina 2 penceresi Binanin heyetine baxir    EVI ALAN ADAM KUPCASINI GOTURE BILER !!    ALICI TEREFDEN 1 % SIRKET HAQQI ODENILMELIDIR !!    elave melumat ucun qeyd olunan nomre ile elaqe saxliya bilersiniz !!,11,Bakı,Nəsimi rayonu,metro. Gənclik,""
672544,2021-06-14,Yeni tikili,13 / 11,100,3,Kupçasız,155000,Vasitəçi / Rieltor,Tefekkur universitetinin yaninda  Qaya Qala Residensde  13/11 100kv Qanuni 3 otaqli podmayak menzil satilir. Menzilin baxisi Tebriz kucesinedi.Bina hazirdi.Tamamlama isleri gedir.1 aya menziller temire verilecek.  Sirket haqqi-1%,15,Bakı,Nərimanov rayonu,metro. Nəriman Nərimanov,""
672543,2021-06-14,Köhnə tikili,4 / 2,80,3,Kupça,175000,Vasitəçi / Rieltor,"Salam əleykum.  İçərişəhər metrosuna 5 dəq məsafədə, Din-nin arxasi, 189-190 nömrəli məktəbin yaninda yerləşən, Arxekturni proyekti olan binada, 4/3-cü mertebesi, orta seviyyede temir olunmuş 80 kv.m sahəsi olan 3 otaqli; 2 yataq, 1 qonaq otaqi, metbexi(mətbəxin pəncərəsi yoxdur), xholu, 1 sanuzelli (hamam-tualti ayri ayriliqda), 1 açiq balkonu v.s olan Mənzil 175 000 manata Satilir.  Senedi Kupçadir.  Işiqi, Qazi, Suyu daimdir.  Elave melumat ucun zeng edin.!  Xidmət Haqqimiz  Alici  Tərəfindən 1% Ödəniləcək!",12,Bakı,Səbail rayonu,metro. İçəri Şəhər,""
672541,2021-06-14,Yeni tikili,14 / 9,203,3,Kupça,390000,Vasitəçi / Rieltor,"DƏYƏRLİ MÜŞTƏRİLƏRİMİZ!!!  Səməd Vurğun bağının yanı,Port Baku və dənizkənarı Milli Parka 10 dəq-lik məsfədə yerləşən, Gülüstan MTK-nın xüsusi zövqlə inşaa etdiyi 14 mərtəbəli elit kompleks binanın 9-cu mərtəbəsində sahəsi 203m2 olan, 4 otaqlı əla təmirli mənzil satılır.Mənzilin təmirində keyfiyyətli inşaat materialları və aksesuarlarından istifadə olunmuşdur.  Bina tam yaşayışlıdır.  Binanın həyətində yaşam üçün vacib olan bütün iaşə obyektləri var.  Binanın geniş bağlı həyəti, həyətdə uşaqlar üçün oyun atraksionları,2 mərtəbəli yeraltı avtodayanacağı,24 saat mühafizə olunan canlı və kamera xidməti movcuddur.  Real müştərilər ilə qiymətdə razılaşmaq olar.  Əlavə məlumat almaq üçün əlaqə saxlıya bilərsiniz.  Vip Hosue daşınmaz əmlak şirkəti olaraq sizlərə xidmət göstərdiyimiz üçün qurur duyuruq.",10,Bakı,Nəsimi rayonu,metro. 28 May,""
672540,2021-06-14,Yeni tikili,6 / 4,35,1,Kupçasız,23000,Vasitəçi / Rieltor,"Masazır qəsəbəsi Qurtuluş 93 yaşayış kompleksində ümumi sahəsi 35 kv/m olan 1 otaqlı təmirsiz mənzil satılır.  Mənzil 6 mərtəbəli binanın 4-cü mərtəbəsində yerləşir, bina katlavandadı, yeni tikilir.",13,Abşeron,Masazır,"",""
672537,2021-06-14,Yeni tikili,12 / 5,126,4,Kupça,141000,Vasitəçi / Rieltor,"TECILI OLARAQ SATILIR !!    Yeni Yasamal, Əsəd Əhmədov küçəsi, Ləziz Housun yanı, yeni tikilmish binanin 5ci mertebesinde 4 otaqli menzil. Bina tam yaşayişlidir. Binada 2 eded lift var. Menzil 126 kv.m.dir, tam temirdlidir. 1 zal, 3 yataq otagi, boyuk metbex, boyuk kolidor, s/t qovşagi ve eyvandan ibaretdir. Hamam ve ws ayridir. Istilik-kombi sistemi. Doşəmə parketdir. Etrafda marketler, geyim magazalari, mekteb, baxcha ve s.her cur iaşe obyektleri var. Menizl çox elverişli yerdedir. Sened-Kupça.    ALICI TEREFDEN 1 % SIRKET HAQQI ODENILMELIDIR !    elave melumat ucun qeyd olunan nomre ile elaqe saxliya bilersiniz !!",12,Bakı,Yasamal rayonu,Yeni Yasamal qəs.,metro. İnşaatçılar
672536,2021-06-14,Köhnə tikili,9 / 3,80,3,Kupça,86000,Vasitəçi / Rieltor,"TƏCİLİ SATILIR#Xalqlar dostluğu metrosuna yaxın,M.Hadi küçəsi,9-mərtəbəli binanın,3-cü mərtəbəsindəki,3-otaqlı mənzil satılır.Kiyev lahiyəli binadır,orta blokdur,təmirsizdır,içərisində kirayeşin yaşayır,sənədi kupçadır.",19,Bakı,Xətai rayonu,Əhmədli,metro. Əhmədli
672534,2021-06-14,Köhnə tikili,9 / 7,60,2,Kupça,78000,Vasitəçi / Rieltor,"Köhnə Günəşlidə İnqilab İsmayılov küçəsində leninqrad layihəli binanın orta blokunda əla təmirli 2 otaqlı mənzil satılır. Döşəmə yüksək keyfiyyətli palıd parketin, qapılar fısdıq ağacındandır. Bina infrastruktur baxımından çox əlverişli yerdədir.",13,Bakı,Xətai rayonu,Əhmədli,""
672532,2021-06-14,Köhnə tikili,9 / 7,42,2,Kupça,67000,Vasitəçi / Rieltor,"8-ci Mikrorayon Naxcivani kucesi BAKU ELEKTRONIKSE yaxin leninqrad layiheli 9 mertebeli binanin 7-ci mertebesinde 1 otaqdan 2 otaqa peredelka olunmuw zeif temirli menzil satilir. qaz, su, iwiq daimidir, istilik sistemi merkezidir.sened kupcadir. (cixariw). son qiymet menzile baxiw kecirdikden sonra deqiqlewecek.",13,Bakı,Binəqədi rayonu,8-ci mikrorayon,metro. Azadlıq prospekti
672531,2021-06-14,Köhnə tikili,9 / 9,75,3,Kupça,62000,Vasitəçi / Rieltor,Sumqayıt şəhəri 9 mk 9/9 . Orta ev 3 otaq. Binanın üstü dövlət siferdi . Yeni müasir liftle təmin edilib. Gozel menzereresi var. 2 balkon var . Otaqlar tualet hamam ayrı ayridi. Əlavə olaraq su çəni var. Qiymət 62 000 AZN,11,Sumqayıt,9-cu mikrorayon,"",""
672529,2021-06-14,Köhnə tikili,10 / 3,70,2,Kupça,114000,Vasitəçi / Rieltor,"Genclik sadliq sarayinin yaninda Genclik metrosuna yaxin Radnoy 2 otaqli temirli menzil satilir., kohne tikili 10 mertebeli binanin 3 cu mertebesinde Eksperimental layihəli binadi., binanin genis ve yasil heyeti parkovkasi ve lifti var., binanin yaxinliginda mekteb bagca market xestexana var., senedler qaydasindadi alqi satqiya hazirdi., OFİSİN XİDMƏT HAQQI 1 % TƏŞKİL EDİR !!!",9,Bakı,Nərimanov rayonu,metro. Gənclik,""
