id,date,V1,V2,V3,V4,V5,V6,V7,V8,V9,V10,V11,V12,V13
405361,2022-10-17,Yeni tikili,17 / 12,76,2,Kupça,157000,Vasitəçi / Rieltor,Azadliq m/s yaxinliqinda 7-ci mkr-da Piramida mtk terefinden yuksek keyfiyyetle insa edilmis yeni tikili 17 mertebeli binanin 12-ci mertebesinde TEMİRLİ ve tam olaraq ESYALİ QANUNU 2 otaqli menzil satilir menzilin temirinde keyfiyyetli materiallardan istifade olunub esyalar bahali firmalarin mehsuludur qaz su isiq daimidir istilik sistemi KOMBİ iledir senedler CİXARİS (KUPCA) iledir İPOTEKAYA yarayir binanin yeralti avtodayanacaqi genis heyetyani sahesi suretli ve muasir liftleri 24 saat muhafizesi var etrafda her bir infrastruktur movcuddur metroya ayaqla 6-7 deqiqelik mesafe OFİS HAQQİ 1%  0502093674,15,Bakı,Binəqədi rayonu,7-ci mikrorayon,metro. Azadlıq prospekti
393790,2022-10-17,Yeni tikili,16 / 12,54,2,Kupça,75000,Vasitəçi / Rieltor,Xirdalanin Tam merkezinde Heyder Parkinin yaninda yeni tikili 16  mertebeli Binanin 12  ci mertebesinde  2 Otaqli menzil eşyali   satilir bina tam yaşayişli binadir qaz su işiq daimdir 24 saat muhafize sened kupca real alcya cuzi endirim olacaq,8,Xırdalan ş.,,,
392337,2022-10-17,Yeni tikili,16 / 11,55,2,Kupça,75000,Vasitəçi / Rieltor,Xirdalanin Tam merkezinde Heyder Parkinin yaninda yeni tikili 16  mertebeli Binanin 12  ci mertebesinde  2 Otaqli menzil  satilir bina tam yaşayişli binadir qaz su işiq daimdir 24 saat muhafize sened kupca real alcya cuzi endirim olacaq,8,Xırdalan ş.,,,
405315,2022-10-17,Yeni tikili,16 / 3,142,3,Kupça,250000,Vasitəçi / Rieltor,"Miqrasiya İdarəsinin yanında, 16/3 mərt. 142kv əla təmir 3 otaqlı mənzil satılır. Mənzilin polu parket, hamam tualet super təmirlidir. Butun avadanlıqlar xarici məhsuldur. Qaz, su ,işıq daimidir. Bina 24 saat kamara nəzarətindədir. Sənəd kupça.",15,Bakı,Nərimanov rayonu,metro. Gənclik,
387369,2022-10-17,Yeni tikili,17 / 15,60,2,Kupça,85000,Vasitəçi / Rieltor,Xirdalanda Merkezi Yolun Tam kenarinda dayanacaga yaxin Yeni tikili 17 mertebeli Binanin 15 ci mertebesinde  2 otaqli  Super temirli menzil Tam eşyali Satilir Menzil Alinandan menzilde Yaşayiş Olunmayib Bina tam yaşayişli Binadir qaz su işiq daimdir binanin 2 lifti ve yeralti qaraji var menzil deyerinden ucuz satilir sened kupca,7,Xırdalan ş.,,,
375411,2022-10-17,Yeni tikili,16 / 12,95,3,Kupça,112000,Vasitəçi / Rieltor,Xirdalanin tam merkezde Kohne Bazarin Yaninda Elitni bir binada 16 mertebeli binanin 12 Ci mertebesinde 3 otaqli temirden yeni cixmiş menzil bina tam yaşayişli binadir qaz su işiq daimdir 24 saat muhafize binanin 2 lifti var temide bahali keyfiyyetli materiallardan istifade olunub sened kupça,7,Xırdalan ş.,,,
405360,2022-10-17,Yeni tikili,9 / 1,57,2,Kupça,66000,Vasitəçi / Rieltor,"Mərkəzdə Kristal Abşeron yaşayış kompleksində aşağı mərtəbədə qanuni 2 otaqlı mənzildir.Sənəd kupçadır.Mənzilin aşağısı qarajdır.Orta mənzildir.Mənzildə Kombi-radiator,mətbəx mebeli ,sanitar qovşağın aksesuarları vardır.Ətraflı məlumat üçün zəng edin",14,Xırdalan ş.,,,
405358,2022-10-17,Köhnə tikili,9 / 4,67,2,Kupça,69000,Vasitəçi / Rieltor,Yeni guneslide qartalin yaninda 2 otaq orta temirli menzil satisda merkezi istilik sistemi var binanin etrafinda mekteb baxca marketler marsurut xettleri movcudur.senedler qaydasindadir.,28,Bakı,Suraxanı rayonu,Yeni Günəşli qəs.,
404065,2022-10-17,Yeni tikili,16 / 8,80,3,Kupça,104000,Vasitəçi / Rieltor,"Xirdalan şeherinde Tam Merkezde Prospekt yolun kenarinda, Yeni tikili Binada qaz və digər komunallar mövcuddur. Ev keyfiyyətli materiallar ilə Tam Temirli və umumi sahesi 80 kv. Orginal 3 Otag 16/8-ci mərtəbəsində yerləşir. Dayanacaga yaxındır. Təcili satılır.nəğd satışdır. Bina tam yaşayışlıdır. Sənəd Kupçali.",9,Xırdalan ş.,,,
399034,2022-10-17,Yeni tikili,16 / 4,90,3,Kupça,85000,Vasitəçi / Rieltor,"Xirdalan şeherinde Tam Merkezde Prospekt yolun kenari, Binada qaz və digər komunallar mövcuddur. Ev keyfiyyətli materiallar ilə tam təmir olunub və ümumi sahəsi 90 kv m. 3 Otag 16/4-ci mərtəbəsində yerləşir. Dayanacaga yaxındır. Təcili satılır.nəğd satışdır. Bina tam yaşayışlıdır. Sənəd Kupça.",5,Xırdalan ş.,,,
386276,2022-10-17,Yeni tikili,6 / 4,56,2,Kupçasız,49000,Vasitəçi / Rieltor,"Xirdalan şəhərində , Yeni Tikili  Binada qaz və digər komunallar mövcuddur. Ev keyfiyyətli materiallar ilə tam təmir olunub və ümumi sahəsi 56 kv m. 2 otaga düzelme 6/4-ci mərtəbəsində yerləşir. Dayanacaga yaxındır. Təcili satılır.nəğd satışdır. Bina tam yaşayışlıdır. Sənəd Müqavile. Əşyali Satilir.  Qeyd; Sizinde Bazar Qiymetine uygun tez satmag istediyiniz Menzil varsa Bizimle Elaqe Saxlaya Bilersiz",12,Xırdalan ş.,,,
405356,2022-10-17,Köhnə tikili,5 / 1,60,2,Kupça,120000,Vasitəçi / Rieltor,"Elmlərdə,Hüseyn Cavid baginin və Vergilər nazirliyinin yaxinliginda,Salatin Əskərova kücəsində,5 mərtəbəli xruşov lahiyyəli binanin 1 ci mərtəbəsində 2 otagli 60 kv.m sahəli mənzil satilir.kürsülüdür,pod obyekt kimidə istifadə etmək olar məhlə icində.təmiri yaxşidir.mənzilin qabaginda bagi var.real alici yigsin.alici ücün xidmət haqqi 1% təşkil .",16,Bakı,Yasamal rayonu,Yasamal qəs.,metro. Elmlər Akademiyası
405355,2022-10-17,Yeni tikili,12 / 1,48,2,Kupça,13000,Vasitəçi / Rieltor,"Sumqayit şəh 9cu mk 12/1 48kv 2 otaq, studiya mətbəx. Tam təmir. İlkin 13000azn .ayliq-360man  19il,5ay qalib",42,Sumqayıt,9-cu mikrorayon,,
403239,2022-10-17,Yeni tikili,5 / 3,101,3,Kupçasız,54000,Vasitəçi / Rieltor,"Xirdalan şeherinde Mektebe yaxin, Yeni tikili Binada qaz və digər komunallar mövcuddur. Ev keyfiyyətli materiallar ilə Podmayak Menzil və umumi sahesi 101 kv. 3 Otag 5/3-ci mərtəbəsində yerləşir. Dayanacaga yaxındır. Təcili satılır.nəğd satışdır. Bina tam yaşayışlıdır. Sənəd Müqavile.",7,Xırdalan ş.,,,
396931,2022-10-17,Yeni tikili,17 / 5,61.5,2,Kupça,43000,Vasitəçi / Rieltor,Xirdalanda Kristal Abşeronda Kohne bazarin yaninda 17 mertebeli binanin 5 ci mertebesinde orginal 2 Otaqli menzil kredit yolu ile satilir ilkin odeniş 43000 azn 9 il 4 ay 575 azn 5 illik ise 870 azn sened kupca senedleşme xerci 3500 azn qiymete daxil deyil etrfli buyurub zmg ede bilersiz,6,Xırdalan ş.,,,
405352,2022-10-17,Yeni tikili,11 / 11,110,3,Kupça,140000,Vasitəçi / Rieltor,"Xətai rayonu,S.Ə.Şirvani küçəsi,Sərhədçi idman mərkəzinə yaxın,ELMA,MTK-ya məxsus,11-mərtəbəli,elit binanın,11-ci mərtəbəsindəki,3-otaqlı (düzəlmə),super təmirli mənzil satılır,pol parket mozaika,mətbəx mebeli,kondisioner,kombi istilik sistemi,mənzilin ümumi sahəsi 110 kv.m.dir,mənzil mərtəbədədir,lift qalxır,su,işıq,qaz daimi vardır,yaxında məktəb,baxça vardır,rahat market,bravo market yanında vardır,xalqlar dostluğu metrosuna 7-8 dəqiqəlik məsafə vardır,qeydiyyat boşdurSənəd=KUPÇA=2-ədəd lift,qaraj,mühafizə vardır..  Ofisin xidmət haqqı 1% təşkil edir.",26,Bakı,Xətai rayonu,Əhmədli,metro. Əhmədli
405350,2022-10-17,Yeni tikili,16 / 2,120,3,Kupça,200000,Vasitəçi / Rieltor,"Yeni yasamal, Bravo marketin yanında yeni binada 3 otaqlı əla təmirli, bazar dəyərindən aşağı qiymətə TƏCİLİ satış.Qaçırmayın təmir çox yaxşıdır və yenidir. Sizin Əmlak Dostunuz CEYHUN M",19,Bakı,Yasamal rayonu,Yeni Yasamal qəs.,metro. İnşaatçılar
405345,2022-10-17,Köhnə tikili,5 / 4,65,2,Kupça,95000,Vasitəçi / Rieltor,Bakixanov qes merkezi erazide lelinqrad proyektinde orta blok 2 otaq tam temirli menzil satisda binanin etrafinda mekteb baxca marketler ve diger iase obyektleri movcudur.senedler tam qaydasindadir.kombi sistemdir.real alicilar elaqe saxlasin,33,Bakı,Sabunçu rayonu,Bakıxanov qəs.,
986997,2022-10-17,Yeni tikili,16 / 14,53,1,Kupça,95000,Vasitəçi / Rieltor,"Tecili satilir! yol qiragi, qaz ve kupca var, dash bina, super layihe, 1 otagdan 2 otaga duzelme,pol - taxta +laminat, Avropa Qapilar, pencereler PVC, asma tavan, gizli ishiglar,hamam-tualet-metbex super temirli,dush kabina,metbex mebeli,kombi, tam temirli bosh menzil,su-qaz-ishiq-otoplenie daimidir, firmada temirsiz 1 kv m 1350 manatdir,maklerler narahat elemesin, ofisin haqqi 1%dir",13,Bakı,Sabunçu rayonu,Bakıxanov qəs.,
405341,2022-10-17,Yeni tikili,17 / 10,70,2,Kupça,127000,Vasitəçi / Rieltor,"= = Kupca+Qaz = =    Hezi Aslanov metrostansiya yaxinliginda yeni tikili yawayiw kompleksinde yerlewen 17/10 mertebesinde,sahesi 70kv/m olan 2 otaqa duzelme ela temirli menzil satilir. Istilik sistemi kombidir. Sened cixariwdir. Eyvandan denize ve wehere menzere acilir. Temirden sonra menzilde yawayiw olmayib. Etrafli melumat ucun zeng edin. Ofis xidmet haqqi 1% teshkil edir.",22,Bakı,Xətai rayonu,metro. Həzi Aslanov ,
405340,2022-10-17,Köhnə tikili,5 / 3,33,1,Kupça,40000,Vasitəçi / Rieltor,"Sumqayıt şəhəri 5 mkr.-da  5/3 mərtəbəsində (orta blok) 1 otaqdan 2 otağa düzəldilmiş + eyvanlı mənzil satılır. Mərkəzi istilik sistemi ilə təchiz olunub.  Məktəb, bağça, dayanacaq , supermarketlər və yaşayış üçün zəruri olan digər obyektlər bir addımlıqdadır.",39,Sumqayıt,5-ci mikrorayon,,
405339,2022-10-17,Yeni tikili,14 / 6,48,2,Kupça,85000,Vasitəçi / Rieltor,Yeni tikili bakixanov qes merkezinde rezidensin insa etdiyi binada yerlesir.46kv..1-otaqdan.2-otaqa duzelib temirlidir.senedler tam qaydasindadir.binanin etrafinda marketler marsurut xetleri diger iase obyektleri movcudur.,23,Bakı,Sabunçu rayonu,Bakıxanov qəs.,
405336,2022-10-17,Yeni tikili,19 / 16,54,2,Kupça,95000,Vasitəçi / Rieltor,"= = Kupca+Qaz = =   Hezi Aslanov metrostansiyasi cixishinda yeni tikili kompleksde 19/16 mertebesinde yerleshen,54kv/m sahesi olan 2 otaqa duzelme ela temirli menzil satilir. Binanin qazi,suyu ve ishigi fasilesizdir. Sened cixariwdir. Kompleksin boyuk heyeti,ushaqlar uchun eylence meydancalari ve baxcalar,idman zallari,marketler,24 saat muhafize xidmeti var. Ofis haqqi umumi meblegin 1% teshkil edir.",24,Bakı,Xətai rayonu,metro. Həzi Aslanov ,
405331,2022-10-17,Köhnə tikili,4 / 3,112,5,Kupça,255000,Əmlak sahibi,"Mənzil 5 otaqdan və 1 əlavə kabinetdən ibarətdir. 4 mərtəbəli binanin 3 cü mərtəbəsində yerləşir. Evdə kombi sistemi, qaz, su, işiq, daimidir. Mənzil əl verişli yerdə yerləşir. Küçəyə tərəf baxılan pəncərə Türk səfirliyi, və shaurma N1 restoranina baxır. Həyətə tərəf baxılan pəncərə isə Tatar Nümayəndəliyinə baxır. Mənzil təmirlidir. Həyətdə mühafizə xidməti mövcuddur.",19,Bakı,Nəsimi rayonu,metro. Gənclik,
405327,2022-10-17,Köhnə tikili,9 / 2,80,3,Kupça,100000,Vasitəçi / Rieltor,"Binəqədi Rayonu Biləcəri qəsəbəsində saral marketin yanında  3 otaqlı mənzil satılır.  Bina Leninqrad layihəldir.  Mərtəbə 9\2.  Mənzil künc blokda yerləşir. Nəmişliyə qarşı lazımi bütün izolyasiya tədbirləri görülüb.  Yelçəkəndir (skvaznoy).  Mərkəzi istilik sistemi var.  Sənəd çxarış (kupça).  Bina abad məhəllədə yerləşir, infrastruktur cəhətdən əlverişli ərazidədir.  Alıcının komissiya haqqı 1 % təşkil edəçək.",15,Bakı,Binəqədi rayonu,,
405326,2022-10-17,Yeni tikili,6 / 5,360,8,Kupça,240000,Vasitəçi / Rieltor,"Cox Təcili Satilir ! Yeni Bulvarla və Su oyunlari sarayinin yaxinliginda Ulu bəy mtkda  5 TRİPLEX MƏNZİL satilir.5 ci mərtəbədə yetləşir, 8 otagdan ibarətdir , ümumi sahəsı 360 kv.m dir.mənzil 3 mərtəbəlidir.şəkillərdən görsənir.mənzilin sənədi  müqavilədilədir,alan şəxs gedib kupca ala bilər.o binalar da lift olmur,sonradan quraşdirmag mümkündür.1-2 binada edilib.xahiş olunur real alici narahat etsin.alici ücün xidmət haqqi 1 % təşkil edir",20,Bakı,Səbail rayonu,Bayıl qəs.,
405324,2022-10-17,Yeni tikili,9 / 5,60,2,Kupça,80000,Vasitəçi / Rieltor,Ünvan :Xırdalan H.Əliyev   pr 30     Növ : Yeni tikili   Mərtəbə : 9/5  Otaq : ORGİNAL 2 otaq    Sahə : 60 m²  Təmir : əla    Sənəd : Kupça   Qiymət : 80.000 manat   Qeyd : Bazar qiymətindən aşağı satılır     Bəzi əşyalar qalacaq   Ofis :  Şəhriyar    +99470 311 00 58,19,Xırdalan ş.,,,
405322,2022-10-17,Yeni tikili,14 / 13,123,3,Kupçasız,145000,Vasitəçi / Rieltor,"Xirdalanda H.Eliyev parkinin yaninda yeni tikili 14 mertebeli binanin 13 cu mertebesi umumi sahesi 123 kv olan  3 otaqli menzil satilir. Bina tam yasayishlidir. Binada qaz, su, ishiq daimidir. Menzilin temirinde keyfiyyetli materiallardan istifade olunub. 2 suretli lift yeralti qaraji(parking) var. binanin yaxinliginda mekteb, bagca, avtobus dayanacagi, park, market, bazar ve s.yerlesir..Senedi Muqaviledir. Bu və digər elanlarla əlaqədar ətraflı məlumat almaq üçün əlaqə nömrəsinə zəng vura bilərsiniz.",18,Xırdalan ş.,,,
404271,2022-10-17,Yeni tikili,15 / 14,74,2,Kupça,85000,Vasitəçi / Rieltor,Satılır-  Sumqayıt ş-də.  Yeni tikilidə 74 kvadratlığ mənzil.  Ərazi-  44 cü məh.15/14-ü.2 otağa əla vəziyətdə düzəlib.  Bina kupçalıdır.  Mənzil tam təmirlidir.  Mənzildə görünən bütün əşyalarda qalacaq.  Mənzil dənizə görüntülüdür.  Mənzilin satış qiyməti-  85000 manata deyilir.  ( Vasitəçi xidmət haqqı-  Alıcı və Satıcı tərəfindən 1%-ödənilir ).,27,Sumqayıt,44-cü məhəllə,,
405316,2022-10-17,Yeni tikili,17 / 7,65,2,Kupçasız,115000,Vasitəçi / Rieltor,"Ehmedli metrostansiyasi yaxinliginda Ukrayna dairesinin yaninda yeni tikili yawayiw kompleksinde 17/7 mertebesinde yerlewen,sahesi 65kv/m olan 2 otaqa duzelme super temirli menzil satilir. Doweme parket,Zambaiti oboylar,Avropa otaq gapilari,metbex mebeli gurawdirilib. Sened muqaviledir. Binaya qaz xetti cekilib,yaxin zamanda menzillere verilecek. Etrafli melumat ucun zeng edin. Ofis haqqi 1% tewkil edir.",21,Bakı,Xətai rayonu,metro. Əhmədli,
405242,2022-10-17,Köhnə tikili,9 / 1,50,1,Kupça,84000,Vasitəçi / Rieltor,8 MKR Naxcivani kucesi Bizim marketin 3-102-276 nomreli orta mekteblerin yani ayna Sultanova parkinin 150 metrliyinde 9 mertebeli LENINQRAD layiheli binain 1 ci mertebesi 1 otaq iki otaqa peredel.orta temir .qaz iwiq su daimi.merkezi istilik sistemi.bow ev 320 azn kirayeye verilib.senedi kupca(CIXARIW).qiymeti 84000 azn.BIR FAIZ ALICI TEREFDEN OFISIN XIDMET HAQQIDIR,22,Bakı,Binəqədi rayonu,8-ci mikrorayon,metro. Azadlıq prospekti
405313,2022-10-17,Yeni tikili,5 / 1,40,2,Kupçasız,45000,Vasitəçi / Rieltor,Bineqedi rayonu Zengezur wadliq sarayi ile uzbe uz yeni tikili 5 mertebeli binanin 1 mertebesinde sahesi 50  kv olan 2 otaqli menzil satilir.  i. sened muqavile.  Su ishiq qaz daimidi.,13,Bakı,Binəqədi rayonu,Rəsulzadə qəs.,metro. Azadlıq prospekti
405294,2022-10-17,Yeni tikili,6 / 6,106,3,Kupça,63000,Vasitəçi / Rieltor,TƏCİLİ SATILIR.qurtuluş 93 yaşayış kompleksində yerləşən 6 mərtəbəli binanın 6 cı mərtəbəsində yerləşən ümumi sahəsi 106 kv metir olan əla təmirli dubleks 3 otaqlı mənzil təcili satılır.təmirdən sonra mənzildə yaşayış olunmayıb.bina tam yaşayışlıdır binada su işıq daimidir şəhərcikdə mərkəzi istilik sistemi var.məktəb və baxçaya yaxındır.şəhərcikdə sakinlərin rahatçılığı üçün hərbir əlverişli şərait yaradılıb.ətraflı məlumat əldə etmək üçün buyurun zənk vurun.,20,Abşeron,Masazır,,
364558,2022-10-17,Yeni tikili,14 / 2,114,3,Kupça,210000,Vasitəçi / Rieltor,Qarayev Metroya yaxin sevinc Kinotiyatrin yani ozbekistan kucesi binada qaz var yasayis var kupca yaxin zamanlarda verlecey bina cox keyfiyetli tiklib taninmis sirketdi ORBITA Mtk ev temirden teze cixib temirden sonra yasayis olmayib evde xirda isler qalib tamamamlanib verlecey hama ataplenyalar konbi hamsi tamamlanib verlecey Metroya piyada 5/6 deqiqe mesafedir kimin bashqa suali varsa zeng Edib etrafli maraqlana biler,14,Bakı,Nizami rayonu,8-ci kilometr,metro. Qara Qarayev
405309,2022-10-17,Yeni tikili,16 / 12,50,2,Kupçasız,85000,Vasitəçi / Rieltor,"16 mərtəbəli binanın 12ci mərtəbəsində 1 otaqlı(2 otağa düzəltmiş) ev təci̇li̇ satilir!!! mənzil 50kv.m-dır. Şəkildə gördüyünüz kimi təmirlidi. Təmirdən sonra yaşayış olmayıb. 7 nömrəli polikninkanın yaxınlığında yerləşir. binada qaz, su, işıq var. binanın həyəti genişdir. mühafizə xidməti vardir. binanın yanında məktəb, baxça, yeni açılmış bravo supermarket, baku medi̇cal plaza və.s vardır. binadan metroya (xalqlar dostluğu və əhmədli mertosuna) 6-7 dəqiqəlik məsafədir. Son qiymət 85000azn-dir.Ofis haqqi-1%",33,Bakı,Xətai rayonu,Əhmədli,metro. Xalqlar Dostluğu
405305,2022-10-17,Köhnə tikili,9 / 8,80,3,Kupça,140000,Vasitəçi / Rieltor,"Yasamal rayonu, Ats-ə yaxın ərazidə yerləşən 9 mərtəbəli binanın 8-ci mərtəbəsində 3 otaqlı tam təmirli mənzil satılır. Mənzil qarşısı açıqdır. Şəhərə əla mənzərə açılır. Parket döşəməli, domofon sistemi və yenilənmiş müasir lifti var.   İpotekya yararlıdır. İpotekanızı almaqda çətinlik çəkirsinizsə biz sizə kömək edə bilərik. Ətraflı məlumat üçün əlaqə saxlayın.     S=80m2  140000Azn",21,Bakı,Yasamal rayonu,metro. İnşaatçılar,
405301,2022-10-17,Yeni tikili,15 / 5,62.5,2,Kupçasız,115000,Vasitəçi / Rieltor,"Nizami rayonu, Neftçilər metrosunun yaxınlığında, yeni tikili, 15 mərtəbəli binanın 5-ci mərtəbəsində, ümumi sahəsi 62.5 kv/m olan, əla təmirli, 2 otaqlı(1-dən-2-yə düzəlmə) mənzil satılır. Qaz, su, işıq daimidir,istilik sistemi kombidir. Binada 24 saat mühafizə, 2 siqma lift, parkinq mövcuddur. Bina bütün infrastrukturlara yaxındır. Sənəd müqavilədir. Qiymət 115.000 manat.",21,Bakı,Nizami rayonu,8-ci kilometr,metro. Neftçilər
405300,2022-10-17,Yeni tikili,5 / 5,75,3,Kupçasız,52000,Vasitəçi / Rieltor,Bineqedi rayonu Zengezur wadliq sarayi ile uzbe uz yeni tikili 4 mertebeli binanin 5 mertebesinde sahesi 75  kv olan 3 otaqli menzil satilir.   i. sened muqavile.  Su ishiq qaz daimidi.,21,Bakı,Binəqədi rayonu,Rəsulzadə qəs.,metro. Azadlıq prospekti
405297,2022-10-17,Yeni tikili,14 / 6,60,2,Kupçasız,105000,Vasitəçi / Rieltor,"Nizami rayonu, Neftçilər metrosunun yaxınlığında, yeni tikili, 14 mərtəbəli binanın 6-cı mərtəbəsində, ümumi sahəsi 60 kv/m olan, yaxşı təmirli, 2 otaqlı(1-dən-2-yə düzəlmə) mənzil satılır. Qaz, su, işıq daimidir, istilik sistemi kombidir. Binada 24 saat mühafizə, 2 siqma lift, parkinq mövcuddur. Bina bütün infrastrukturlara yaxındır. Sənəd müqavilədir. Qiymət 105.000 manat.",21,Bakı,Nizami rayonu,8-ci kilometr,metro. Neftçilər
196614,2022-10-17,Yeni tikili,13 / 2,86,4,Kupçasız,80000,Vasitəçi / Rieltor,Xirdalanda Merkezde 3 nom mektebn yani Baki sumqayt yolunun kenarinda yeni tikili 13 mertebeli binanin 2 ci mertebesinde 4 otaqa duzelme şexsi istifade üçün temir olunmus bina evi bina tam yaşayişli binadir mektebe bagacaya bazara yaxindir qaz su işiq daimdir sened aaf parka mexsus muqViledir,14,Xırdalan ş.,,,
372984,2022-10-17,Yeni tikili,13 / 3,54,2,Kupça,55000,Vasitəçi / Rieltor,Xirdalanda 3 Nom mektebin yani baki sumqayit yolunun kenarinda 13 mertebeli Binanin 3 cu mertebesinde 2 otaqa duzelme şexsi temirli menzil bina tam yaşayişli binadir qaz su işiq daimdir butun kamunallar var sened aaf parka mexsus muqaviledir,16,Xırdalan ş.,,,
304295,2022-10-17,Yeni tikili,15 / 3,61.5,2,Kupça,42000,Vasitəçi / Rieltor,Xirdalanda Kristal Abşeronda icra Hakimiyyetinin yani baki sumqayit suret qatarinij yaninda 15 mertebeli binanin 3 ci mertebesinde orginal 2 otaq menzil  kredit yolu ile satilir senedleşme daxil ilkin odeniş 42000 azn 13 il 9 ay 650 azn krediti qalib menzil eşyali satilir sened kupça,22,Xırdalan ş.,,,
320298,2022-10-17,Yeni tikili,12 / 10,50,2,Kupça,30500,Vasitəçi / Rieltor,Xirdalanda Kristal Abşeronda kohne bazarin yaninda 12 mertrbeli binanin 10 cu mertebesinde 2 otaga duzelme menzil kredit yolu ile satilir senedleşme daxil ilkin odeniş 30500 azn 120 ay 500azn krediti qalib  binada qaz su işiq daimdir binanin 2 lifti var sened kupça,17,Xırdalan ş.,,,
405296,2022-10-17,Köhnə tikili,9 / 2,50,1,Kupça,80000,Vasitəçi / Rieltor,"Nərimanov rayonu, Gənclık metrosunun yaxınlığında, Stanbul klinikasının yanında, Leninqrad layihəli, 9 mərtəbəli binanın 2-ci mərtəbəsində, ümumi sahəsi 50 kv/m olan, orta təmirli, 1 otaqlı mənzil satılır. Qaz, su, işıq daimidir, istilik sistemi mərkəzidir. Sənəd KUPÇADIR. Qiymət 80.000 manat.",20,Bakı,Nərimanov rayonu,metro. Gənclik,
401928,2022-10-17,Köhnə tikili,5 / 5,60,2,Kupça,85000,Vasitəçi / Rieltor,"Qara Qarayev metrona yaxin yerləşir. Çox əlverişli infrastrukturu var. İdeal variantdir. Mənzil 5/5-ci mertebe, 2-otaq, Umumi sahesi 60 kv/m, tam təmirsiz. Çıxarış (Kupça) var. İpotekaya yararlıdır. Açarlar məndədir gunun istənilən vaxti baxmaq olar. Ətrafli məlumat uçun zəng edin. Qiymet: 85.000 azn",14,Bakı,Nizami rayonu,8-ci kilometr,metro. Qara Qarayev
405293,2022-10-17,Köhnə tikili,9 / 1,50,1,Kupça,55000,Vasitəçi / Rieltor,"Günəşli Əmlak sizlərə yeni mənzillər təqdim edir   Yeni Günəşli Ab massivi 9/1 təmirli 1 otaq Orta blok ƏŞYALI mənzil satılır.Mənzil yelçələndi(skvaznoy)hər iki tərəfə baxışı var.Mənzildə olan bütün əşyalar qalacaq.Bina düz dayanan və bütün infrasrukturlara yaxın yerdədir.Su,qaz,işıq daimidir.  Xidmət haqqı:2%",31,Bakı,Suraxanı rayonu,Yeni Günəşli qəs.,metro. Xalqlar Dostluğu
352059,2022-10-17,Yeni tikili,15 / 8,120,3,Kupça,270000,Vasitəçi / Rieltor,"Tecili... Elveriwli Teklif ,Nerimanov rayonunda Heyder Eliyev Merkezinin Yaninda , Merkezde, Metroya 5-10 deyqelik Mesafede Yeni Tikilide 3 Otaqli 120 kv. Temirli EWYALI Menzil SATILIR, KUPCASI var IPOTEKAYA uygun gelir .Merkezin Yaninda yerlewir. Deyerinden ucuz qiymete .Menzile Baxiw zamani qiymet muzakire edile biler",14,Bakı,Nərimanov rayonu,metro. Nəriman Nərimanov,
405289,2022-10-17,Yeni tikili,19 / 17,109,2,Kupça,210000,Vasitəçi / Rieltor,"TƏCİLİ SATİLİR!!  İPOTEKAYA YARARLİ!!  Nəsimi bazarin yaxinliqda yerləşən 19 mərtəbəli yeni tikili binanin 16 ci mərtəbəsində TƏMİRLİ VƏ ƏŞYALİ MƏNZİL SATİLİR.  Ümumi səhəsi 109 kv.m. geniş və işiqlidir,2 sanitar qovşagi,qurulmuş mətbəx və dolab mebelləri,isitmə kombi,qaz su işiq daimi.  Sənəd CİXARİŞ.  Şirkətin xidmət haqqi 1%",15,Bakı,Binəqədi rayonu,metro. Gənclik,
405288,2022-10-17,Yeni tikili,19 / 17,170,4,Kupça,280000,Vasitəçi / Rieltor,"SOS QİYMƏTDƏ 55.000 AZN ENDİRİM  OLDU !!!  SOS TƏCİLİ QİYMƏT 340.000 AZN YOX 285.000  AZN oldu  SATILIR  Ünvan: Ximqorodok, Həsən Əliyev küç.  Növ: Yeni tikili  Mərtəbə: 19/17  Otaq: 4 otaq +  Sahə: 170 m²  Təmir: Əla Təmirli  Sənəd: Çıxarış (Kupça)   Qiymət: 280.000m  Qeyd: Mənzilin qazı, suyu, işığı daimidir, istilik  sistemi kombidir. Mənzilin 2 sanuzeli, 3 eyvanı var.  Pəncərələrin qarşısı açıqdır.",19,Bakı,Nərimanov rayonu,metro. Gənclik,
405286,2022-10-17,Yeni tikili,17 / 12,76,2,Kupça,158000,Vasitəçi / Rieltor,"TƏCİLİ DƏYƏRİNDƏN UCUZ !  QANUNİ 2 OTAQLİ !  ƏŞYALİ !  İPOTEKAYA YARARLİ !    7 mkr Azadliq metrosuna piyada 5-10 deqiqədə məsafədə olan. Yeni tikili 17mərtəbəli binanin 12 ci mərtəbəsi.Binanin yerləşdiyi yer yüksek infrastruktora malikdir, komfort yaşamaq üçün her bir şəraiti var. QAZ. SU. İŞİQ DAİMİDİR  SƏNƏD - ÇİXARİŞ (KUPÇA)  Ofis haqqi - 1 %",18,Bakı,Binəqədi rayonu,7-ci mikrorayon,metro. Azadlıq prospekti
405283,2022-10-17,Köhnə tikili,5 / 4,42,2,Kupça,95000,Vasitəçi / Rieltor,"TECILI EKSKLUZIV ELAN! Bu eraziler ucun hal hazirda iIDEAL TEKLIFDIR! Menzil haqqinda elani sonacan oxuyun ve sonra elaqe saxlayin zehmet olmazsa.Real olan alicilarin duqqetine.Yasamal Rayonu,Dovlet Statistika Komitesinin ve 21-ci esr mektebin tam olaraq yaninda,bir basa olaraq Merkezi parkin tam olaraq yaninda yerlesen Stalinka lahiyeli das binada menzil satilir.Ev hazir tam temirli,seliqeli bir sekilde gir yasadir.Mertebe 5/4-dur.Menzil ideal planirovka ile bir otaqdan iki otaga duzeldilmisdir.Qaz,su ve isiq daimidir(24/7).Faktiki umumi kvadratura,sahe 42 kvm-dir,iki otaqli Xrusovkanin umumi sahesi qeder.Senedler hamisi qaydasindadir(cixaris,kupca).Hundur tavan,isiqli ve yelceken(skvaznoy)-dur.Sened baxilmasa radnoy,qanuni iki otaqlidan hec de secilmir.Otaqlarin hamisi ve metbex daxil olmaqla ayri ayriliqda,hamisi pencerelidir.Doseme(pol) parket,Pvc ve s.vardir.Menzilde istilik sistemi kombidir.Evin sahec boyuk bir balkonu movcuddur.Sehere,denize ve merkezi parka gozel menzeresi var.Ekoloji cehetden temiz havasi,merkezi erazilerden birisi sayilan prestij kantingent.Yasamaga ve uzun muddetli kiraye verilmesine gore her bir cehetden cox elverisli ev,erazidir.Binanin ozune mexsus gozel gorunusu,gece goruntulu isiqlar ile dovlet terefinden fasadlanan binadir.Etrafda her bir infrastruktura movcuddur.Mektebler,ali tehsil ocaglari,universiterler,usaq bagcalari,dayanacqlar,bir nece sayda metro stansiyalar,bank,poct,Merkezi Park,Izmir parki,alis veris merkezleri ve s.vardir.Diqqet:Menzilin satis bagli esyalarla birlikde son qiymet 95.000 manatdir,esyasiz ise start satis meblegi 95.000 manatdir.Asili olaraq real alicidan,fikri ciddi nagd elinde pulu olan alici ile qiymetde eve baxdiqdan sonra menzil sahibi ile razilasma elde olunacqdir.Firmaya,ofise xidmet haqqi 1%-dir.Qeyri ciddi sexsler,fantastik bir endirim gozleyenler narahat etmesinler.",19,Bakı,Yasamal rayonu,metro. Nizami,
